Parsed test spec with 4 sessions

starting permutation: rc_before w_begin w_update w_commit rc_during wake w_noop detach rc_after
injection_points_attach
-----------------------
                       
(1 row)

step rc_before: 
	SELECT pg_current_snapshot_uses_csn() AS uses_csn, val
	FROM csn_commit_published
	WHERE id = 1;

uses_csn|val
--------+---
t       |  0
(1 row)

step w_begin: BEGIN;
step w_update: UPDATE csn_commit_published SET val = 1 WHERE id = 1;
step w_commit: COMMIT; <waiting ...>
step rc_during: 
	SELECT pg_current_snapshot_uses_csn() AS uses_csn, val
	FROM csn_commit_published
	WHERE id = 1;

uses_csn|val
--------+---
t       |  1
(1 row)

step wake: SELECT injection_points_wakeup('commit-after-csn-publication'); <waiting ...>
step w_commit: <... completed>
step w_noop: 
step wake: <... completed>
injection_points_wakeup
-----------------------
                       
(1 row)

step detach: SELECT injection_points_detach('commit-after-csn-publication');
injection_points_detach
-----------------------
                       
(1 row)

step rc_after: 
	SELECT pg_current_snapshot_uses_csn() AS uses_csn, val
	FROM csn_commit_published
	WHERE id = 1;

uses_csn|val
--------+---
t       |  1
(1 row)


starting permutation: w_begin w_update w_commit rr_begin rr_during wake w_noop detach rr_after rr_commit
injection_points_attach
-----------------------
                       
(1 row)

step w_begin: BEGIN;
step w_update: UPDATE csn_commit_published SET val = 1 WHERE id = 1;
step w_commit: COMMIT; <waiting ...>
step rr_begin: BEGIN ISOLATION LEVEL REPEATABLE READ;
step rr_during: 
	SELECT pg_current_snapshot_uses_csn() AS uses_csn, val
	FROM csn_commit_published
	WHERE id = 1;

uses_csn|val
--------+---
t       |  1
(1 row)

step wake: SELECT injection_points_wakeup('commit-after-csn-publication'); <waiting ...>
step w_commit: <... completed>
step w_noop: 
step wake: <... completed>
injection_points_wakeup
-----------------------
                       
(1 row)

step detach: SELECT injection_points_detach('commit-after-csn-publication');
injection_points_detach
-----------------------
                       
(1 row)

step rr_after: 
	SELECT pg_current_snapshot_uses_csn() AS uses_csn, val
	FROM csn_commit_published
	WHERE id = 1;

uses_csn|val
--------+---
t       |  1
(1 row)

step rr_commit: COMMIT;
