Parsed test spec with 4 sessions

starting permutation: reset w_begin w_update_commit w_commit r_during_commit wake detach r_after_commit
step reset: 
	UPDATE csn_ordinary_after_procarray_primary SET val = 0 WHERE id = 1;

step w_begin: 
	BEGIN;
	SELECT injection_points_set_local();
	SELECT injection_points_attach('ordinary-after-procarray-primary', 'wait');

injection_points_set_local
--------------------------
                          
(1 row)

injection_points_attach
-----------------------
                       
(1 row)

step w_update_commit: UPDATE csn_ordinary_after_procarray_primary SET val = 1 WHERE id = 1;
step w_commit: COMMIT; <waiting ...>
step r_during_commit: 
	SELECT val
	FROM csn_ordinary_after_procarray_primary
	WHERE id = 1;

val
---
  1
(1 row)

step wake: SELECT injection_points_wakeup('ordinary-after-procarray-primary'); <waiting ...>
step w_commit: <... completed>
step wake: <... completed>
injection_points_wakeup
-----------------------
                       
(1 row)

step detach: SELECT injection_points_detach('ordinary-after-procarray-primary');
injection_points_detach
-----------------------
                       
(1 row)

step r_after_commit: 
	SELECT val
	FROM csn_ordinary_after_procarray_primary
	WHERE id = 1;

val
---
  1
(1 row)


starting permutation: reset w_begin w_update_abort w_abort r_during_abort wake detach r_after_abort
step reset: 
	UPDATE csn_ordinary_after_procarray_primary SET val = 0 WHERE id = 1;

step w_begin: 
	BEGIN;
	SELECT injection_points_set_local();
	SELECT injection_points_attach('ordinary-after-procarray-primary', 'wait');

injection_points_set_local
--------------------------
                          
(1 row)

injection_points_attach
-----------------------
                       
(1 row)

step w_update_abort: UPDATE csn_ordinary_after_procarray_primary SET val = 2 WHERE id = 1;
step w_abort: ABORT; <waiting ...>
step r_during_abort: 
	SELECT val
	FROM csn_ordinary_after_procarray_primary
	WHERE id = 1;

val
---
  0
(1 row)

step wake: SELECT injection_points_wakeup('ordinary-after-procarray-primary'); <waiting ...>
step w_abort: <... completed>
step wake: <... completed>
injection_points_wakeup
-----------------------
                       
(1 row)

step detach: SELECT injection_points_detach('ordinary-after-procarray-primary');
injection_points_detach
-----------------------
                       
(1 row)

step r_after_abort: 
	SELECT val
	FROM csn_ordinary_after_procarray_primary
	WHERE id = 1;

val
---
  0
(1 row)

