Parsed test spec with 4 sessions

starting permutation: reset wb_begin w_update w_commit r_before wake_before detach_before
step reset: 
	UPDATE csn_snapshot_xmax_latest_completed SET val = 0 WHERE id = 1;

step wb_begin: 
	BEGIN;
	SELECT injection_points_set_local();
	SELECT injection_points_attach('ordinary-before-procarray-primary', 'wait');

injection_points_set_local
--------------------------
                          
(1 row)

injection_points_attach
-----------------------
                       
(1 row)

step w_update: UPDATE csn_snapshot_xmax_latest_completed SET val = val + 1 WHERE id = 1;
step w_commit: COMMIT; <waiting ...>
step r_before: 
	WITH snap AS (
		SELECT pg_current_snapshot() AS snap
	)
	SELECT pg_current_snapshot_uses_csn() AS uses_csn,
		pg_snapshot_xmax(snap)::text::int8 =
			injection_points_latest_completed_xid()::text::int8 + 1
			AS xmax_matches_latest,
		pg_snapshot_xmax(snap)::text::int8 =
			injection_points_latest_completed_xid_shadow()::text::int8 + 1
			AS xmax_matches_shadow
	FROM snap;

uses_csn|xmax_matches_latest|xmax_matches_shadow
--------+-------------------+-------------------
t       |t                  |t                  
(1 row)

step wake_before: SELECT injection_points_wakeup('ordinary-before-procarray-primary'); <waiting ...>
step w_commit: <... completed>
step wake_before: <... completed>
injection_points_wakeup
-----------------------
                       
(1 row)

step detach_before: SELECT injection_points_detach('ordinary-before-procarray-primary');
injection_points_detach
-----------------------
                       
(1 row)


starting permutation: reset wa_begin w_update w_commit r_after wake_after detach_after
step reset: 
	UPDATE csn_snapshot_xmax_latest_completed SET val = 0 WHERE id = 1;

step wa_begin: 
	BEGIN;
	SELECT injection_points_set_local();
	SELECT injection_points_attach('ordinary-after-procarray-primary', 'wait');

injection_points_set_local
--------------------------
                          
(1 row)

injection_points_attach
-----------------------
                       
(1 row)

step w_update: UPDATE csn_snapshot_xmax_latest_completed SET val = val + 1 WHERE id = 1;
step w_commit: COMMIT; <waiting ...>
step r_after: 
	WITH snap AS (
		SELECT pg_current_snapshot() AS snap
	)
	SELECT pg_current_snapshot_uses_csn() AS uses_csn,
		pg_snapshot_xmax(snap)::text::int8 =
			injection_points_latest_completed_xid()::text::int8 + 1
			AS xmax_matches_latest,
		pg_snapshot_xmax(snap)::text::int8 =
			injection_points_latest_completed_xid_shadow()::text::int8 + 1
			AS xmax_matches_shadow
	FROM snap;

uses_csn|xmax_matches_latest|xmax_matches_shadow
--------+-------------------+-------------------
t       |t                  |t                  
(1 row)

step wake_after: SELECT injection_points_wakeup('ordinary-after-procarray-primary'); <waiting ...>
step w_commit: <... completed>
step wake_after: <... completed>
injection_points_wakeup
-----------------------
                       
(1 row)

step detach_after: SELECT injection_points_detach('ordinary-after-procarray-primary');
injection_points_detach
-----------------------
                       
(1 row)

